{
  "document_type": "process_flow",
  "locale": "zh-CN",
  "meta": {
    "title": "需求评审与上线流程",
    "subtitle": "确保每个需求从提出到上线都经过充分验证",
    "eyebrow": "Momo Paper / process_flow / zh-CN"
  },
  "sections": {
    "lead": {
      "body": [
        "本流程适用于所有产品需求的评审与上线。目标是在保证质量的前提下，缩短需求交付周期，减少上线后回滚。"
      ]
    },
    "flow": {
      "steps": [
        {
          "number": 1,
          "title": "需求提交",
          "description": "产品经理在 Jira 创建需求单，填写背景、目标、验收标准",
          "owner": "产品经理"
        },
        {
          "number": 2,
          "title": "需求预审",
          "description": "技术负责人评估技术可行性，给出初步排期",
          "owner": "技术负责人"
        },
        {
          "number": 3,
          "title": "评审会议",
          "description": "产品、技术、测试三方评审，确认需求范围和验收标准",
          "owner": "产品经理"
        },
        {
          "number": 4,
          "title": "开发与自测",
          "description": "开发人员按需求实现，完成单元测试并提交代码审查",
          "owner": "开发人员"
        },
        {
          "number": 5,
          "title": "测试验收",
          "description": "QA 执行功能测试、回归测试，确认无阻塞性 Bug",
          "owner": "QA 工程师"
        },
        {
          "number": 6,
          "title": "灰度发布",
          "description": "先发布至 5% 用户，观察 24 小时核心指标无异常后全量",
          "owner": "运维工程师"
        }
      ]
    },
    "branches": {
      "body": [
        "以下情况需要走特殊审批流程："
      ],
      "conditions": [
        "涉及数据库 schema 变更 → 需 DBA 审核并制定回滚方案",
        "涉及支付/资金相关 → 需风控团队额外审批",
        "涉及用户隐私数据 → 需法务与合规团队审批",
        "紧急修复（P0 级 Bug）→ 可跳过评审会议，但需事后补文档"
      ]
    },
    "takeaways": {
      "body": [
        "每个环节都有明确的负责人和产出物，避免责任模糊。"
      ],
      "checklist": [
        "需求单是否包含验收标准？",
        "技术方案是否经过评审？",
        "是否有对应的测试用例？",
        "灰度期间是否监控核心指标？",
        "上线后是否发送通知给相关方？"
      ]
    }
  }
}
